{
  "schema_version": "1.0.0",
  "id": "tsu_campuses",
  "status": "maintained",
  "description": "Области локальных инструкций; other не наследует основной кампус.",
  "entries": [
    {
      "code": "main",
      "label": "Основной подтверждённый контекст (см. ограничения вуза)"
    },
    {
      "code": "other",
      "label": "Иной кампус/филиал — локальные сведения не подтверждены"
    }
  ]
}
