{
  "schema_version": "1.0.0",
  "id": "hse_campuses",
  "status": "maintained",
  "description": "Области локальных инструкций; other не наследует основной кампус.",
  "entries": [
    {
      "code": "main",
      "label": "Основной подтверждённый контекст (см. ограничения вуза)"
    },
    {
      "code": "spb",
      "label": "Санкт-Петербург"
    },
    {
      "code": "nnov",
      "label": "Нижний Новгород"
    },
    {
      "code": "perm",
      "label": "Пермь"
    },
    {
      "code": "other",
      "label": "Иной кампус/филиал — локальные сведения не подтверждены"
    }
  ]
}
