{
  "schema_version": "1.0.0",
  "id": "countries",
  "status": "maintained",
  "description": "Подмножество кодов ISO 3166-1 alpha-2 в нижнем регистре для аудита. Не полный справочник гражданств и не таблица визовых/договорных льгот.",
  "entries": [
    {
      "code": "by",
      "label": "Беларусь"
    },
    {
      "code": "kz",
      "label": "Казахстан"
    },
    {
      "code": "kg",
      "label": "Киргизия"
    },
    {
      "code": "am",
      "label": "Армения"
    },
    {
      "code": "uz",
      "label": "Узбекистан"
    },
    {
      "code": "tj",
      "label": "Таджикистан"
    },
    {
      "code": "cn",
      "label": "Китай"
    },
    {
      "code": "in",
      "label": "Индия"
    },
    {
      "code": "de",
      "label": "Германия"
    },
    {
      "code": "ru",
      "label": "Россия"
    }
  ]
}
