{
  "schema_version": "1.0.0",
  "id": "event_types",
  "status": "maintained",
  "description": "Локальные события, подтверждаемые сервисом; не правовые обязанности.",
  "entries": [
    {
      "code": "hse_rvpo_received",
      "label": "Получено РВПО"
    },
    {
      "code": "hse_extended_documents_received",
      "label": "Получены документы продления пребывания"
    },
    {
      "code": "hse_private_registration_received",
      "label": "Получена регистрация по частному адресу"
    }
  ]
}
