{
  "schema_version": "1.0.0",
  "id": "event_types",
  "status": "maintained",
  "description": "Локальные события, подтверждаемые сервисом; не правовые обязанности.",
  "entries": [
    {
      "code": "tsu_medical_fingerprint_completed",
      "label": "Самостоятельно завершены медосвидетельствование и дактилоскопия"
    }
  ]
}
