{
  "schema_version": "1.0.0",
  "id": "event_types",
  "status": "maintained",
  "description": "Локальные события, подтверждаемые сервисом; не правовые обязанности.",
  "entries": [
    {
      "code": "mephi_private_registration_received",
      "label": "Получена регистрация по частному адресу"
    },
    {
      "code": "mephi_arrival_support_requested",
      "label": "Студент выбрал обращение по вопросу приезда"
    }
  ]
}
